{
  "required" : true ,
  "$schema" : "http://json-schema.org/draft-03/schema" ,
  "type" : "object" ,
  "properties" : {
    "email" : {
      "type" : "string" ,
      "required" : false
    } ,
    "id" : {
      "type" : "number" ,
      "required" : false
    } ,
    "initials" : {
      "type" : "string" ,
      "required" : false
    } ,
    "kind" : {
      "type" : "string" ,
      "required" : false
    } ,
    "name" : {
      "type" : "string" ,
      "required" : false
    } ,
    "username" : {
      "type" : "string" ,
      "required" : false
    }
  }
}